<!ELEMENT agenda (persona)+>
<!ELEMENT persona (nombre, email*, relacion?)>
<!ELEMENT nombre (#PCDATA)>
<!ELEMENT email (#PCDATA)>
<!ELEMENT relacion EMPTY>
<!ATTLIST persona id ID #REQUIRED>
<!ATTLIST persona sexo (hombre|mujer) #IMPLIED>
<!ATTLIST relacion amigo_de IDREFS #IMPLIED>
<!ATTLIST relacion enemigo_de IDREFS #IMPLIED>
